2009/10/8,非表示,,日神デュオステージ常盤台銀座,現地モデルルーム公開中(予約制),http://www.duostage.com/tokiwadai_ginza/,thumb/h21/tokiwadai_ginza_icon.gif,東京23区,,東京都板橋区南常盤台一丁目30番7,東武東上線「ときわ台」駅より徒歩2分,,,,「池袋」「新宿」駅へ15分圏内のスピーディーなアクセス\nときわ台駅徒歩2分。駅から続く商店街の一画に立地\n明るい光を取り入れる全戸南東向きの心地よい住空間,2410,2420,2410,2420,30.00㎡,30.00㎡,https://enq.nisshinfudosan.co.jp/form/fm/honsya/tokiwadai_ginza,1DK,1DK,,,,,,,
2009/7/17,非表示,,日神デュオステージ大島,棟内モデルルーム公開中,http://www.duostage.com/ojima/,thumb/h21/ojima_icon.gif,東京23区,,東京都江東区大島三丁目32番9,都営新宿線「大島」駅より徒歩3分,JR総武線「亀戸」駅より徒歩14分,,,新宿へ直通18分と主要エリアにスピーディにアクセス可能\n毎日のくらしを明るくする南向き中心の明るいルームプラン\n緑の潤いと生活に便利な店舗が揃う贅沢な住環境,2870,2960,2870,2960,30.71㎡,30.71㎡,https://enq.nisshinfudosan.co.jp/form/fm/honsya/ojima,1DK,1DK,,,,,,,
2009/6/12,非表示,,日神パレステージ小作,現地モデルルーム公開中,http://www.nisshinfudosan.co.jp/ozaku/,thumb/h21/ozaku_icon.gif,東京都下,,東京都羽村市小作台五丁目13番1,JR青梅線「小作」駅より徒歩2分,,,,白を基調とした優美で明るいエントランスホール\nバスルームで簡単に音楽が聞けるBGMインターホンリモコンを設置\n暮らす人々に潤いと活力を与える緑に包まれた周辺環境,2900,3810,2900,3810,54.00㎡,73.33㎡,https://enq.nisshinfudosan.co.jp/form/fm/honsya/ozaku,1LDK+S,3LDK+DEN,,,,,,,
2008/12/26,非表示,,日神デュオステージ押上,先着順受付中,http://www.duostage.com/oshiage/,thumb/h20/oshiage_icon.gif,東京23区,,東京都墨田区京島二丁目9番,京成押上線「京成曳舟」駅より徒歩7分,東京メトロ半蔵門線「押上」駅より徒歩10分,,,徒歩10分圏内で3駅5路線利用可能な好立地\n進化する押上・曳舟エリア。商業施設も充実の住環境\n都市生活には欠かせない安心のセキュリティシステムを採用,2750,2760,2750,2760,40.02㎡,40.02㎡,https://enq.nisshinfudosan.co.jp/form/fm/honsya/oshiage,1LDK,1LDK,,,,,,,
2008/12/25,非表示,,日神デュオステージ両国,先着順受付中,http://www.duostage.com/ryogoku/,thumb/h20/ryogoku_icon.gif,東京23区,,東京都墨田区本所一丁目7番1,都営大江戸線「両国」駅より徒歩6分,都営浅草線「蔵前」駅より徒歩10分,,,4駅3路線利用可能でビジネスもレジャーも思いのまま\n都会でありながら、時に江戸情緒も感じられる住環境\n錦糸町・浅草・押上エリアへも自転車で気軽にお出かけできます,2550,2660,2550,2660,30.27㎡,35.63㎡,https://enq.nisshinfudosan.co.jp/form/fm/honsya/ryogoku,1DK,1DK,,,,,,,
2008/12/25,非表示,,日神デュオステージ板橋,先着順受付中,http://www.duostage.com/itabashi/,thumb/h20/itabashi_icon.gif,東京23区,,東京都板橋区板橋一丁目49番6,都営三田線「新板橋」駅より徒歩3分,JR埼京線「板橋」駅より徒歩4分,,,3駅3路線が徒歩7分圏内に集中する好立地\n駅近ながらも親しみやすい街並みの住環境\nお手入れしやすく安全なIHクッキングヒーターを設置,2320,2420,2320,2420,30.03㎡,30.08㎡,https://enq.nisshinfudosan.co.jp/form/fm/honsya/itabashi,1DK,1DK,,,,,,,
2008/12/25,非表示,,日神デュオステージ浅草今戸,先着順受付中,http://www.duostage.com/asakusa_imado,thumb/h20/asakusa_imado_icon.gif,東京23区,,東京都台東区今戸二丁目10番1,東武伊勢崎線「浅草」駅より徒歩15分,東京メトロ銀座線「浅草」駅より徒歩16分,,,全10タイプの間取りプランは全戸明るい南向き\n上層階からは隅田川の花火大会も望める立地\n下町ならではの街並みで暮らしやすい住環境,2140,2200,2140,2200,30.32㎡,30.32㎡,https://enq.nisshinfudosan.co.jp/form/fm/honsya/asakusa_imado,1DK,1LDK,,,,,,,
2008/12/25,非表示,,日神デュオステージ北浦和,先着順受付中,http://www.nisshinfudosan.co.jp/kitaurawa/,thumb/h20/kitaurawa_icon.gif,埼玉,,埼玉県さいたま市浦和区常磐三丁目23番3,JR京浜東北線「北浦和」駅より徒歩6分,,,,上野へ21分、池袋へ25分と主要都市にスピーディにアクセス可能。\n全タイプ２面採光・３面採光の開放感溢れる住戸設計。\n北浦和の街並みに融合した地上１４階建ての全４３邸。,2170,2170,2170,2170,33.18㎡,33.18㎡,https://enq.nisshinfudosan.co.jp/form/fm/honsya/kitaurawa,1DK,1DK,,,,,,,
2008/12/22,非表示,,日神デュオステージ新中野,先着順受付中,http://www.shinnaka-style.com/,thumb/h20/shinnakano_icon.gif,東京23区,,東京都中野区中央五丁目17番1,東京メトロ丸ノ内線「新中野」駅より徒歩6分,JR中央線・総武線「中野」駅より徒歩13分,,,3駅4路線利用可能で、都心へのアクセスも抜群。\n新宿まで直通6分、東京駅へも19分の好立地。\n毎日の買い物から、おしゃれなカフェタイムまで充実の街並み,3580,3660,3580,3660,44.83㎡,44.83㎡,https://enq.nisshinfudosan.co.jp/form/fm/honsya/shinnakano,1LDK,1LDK,,,,,,,
2008/10/17,非表示,,日神デュオステージ王子神谷,棟内モデルルーム公開中,http://www.duostage.com/ojikamiya/,thumb/h20/ojikamiya_icon.gif,東京23区,,東京都北区王子五丁目8番1,東京メトロ南北線「王子神谷」駅より徒歩2分,JR京浜東北線「東十条」駅より徒歩13分,,,駅徒歩２分の立地に暮らしながらも自然と共存するロケーション\n新宿・東京・秋葉原駅などへ２０分以内のマルチアクセス\n住むほどに使いやすさを実感する、機能性を重視した設備・仕様,2380,2630,2380,2630,30.06㎡,30.20㎡,https://enq.nisshinfudosan.co.jp/form/fm/honsya/ojikamiya,1DK,1DK,,,,,,,
2008/10/1,非表示,,日神パレステージ横濱鶴見フォレスト,棟内モデルルーム公開中,http://www.tsurumi-forest.com/,thumb/h20/tsurumi_icon.gif,神奈川,,横浜市鶴見区東寺尾中台33番1,JR京浜東北線「鶴見」駅より徒歩19分,,,,閑静で上質な住宅街に溶け込む地上5階建の低層フォルム\n住む方の健康と安全性、心地よさを配慮したルームプラン\n緊急地震速報システム等万一に備えた設備を兼ね備えました,4030,4030,4030,4030,74.56㎡,74.56㎡,https://enq.nisshinfudosan.co.jp/form/fm/yokohama/yokohama_tsurumi,3LDK,3LDK,,,,,,,
2008/9/27,非表示,,デュオシティ鵜の木,現地内覧可（予約制）,http://www.nisshinfudosan.co.jp/duocity_unoki/,thumb/h20/unoki_icon.gif,東京23区,,東京都大田区鵜の木一丁目16番13,東急多摩川線「鵜の木」駅より徒歩3分,東急池上線「久が原」駅より徒歩11分,,,駅徒歩３分でありながら落ち着いて暮らせる恵まれた住環境\n角地の開放感を生かした南西向き・東南向きに配置した住戸\n心地よい日常を実感させるこだわりの構造・セキュリティ,3090,4290,3090,4290,30.29㎡,40.51㎡,https://enq.nisshinfudosan.co.jp/form/fm/honsya/unoki,1DK,1LDK,,,,,,,
2008/9/27,非表示,,デュオシティ大森町,現地内覧可（予約制）,http://www.nisshinfudosan.co.jp/omorimachi/,thumb/h20/omorimachi_icon.gif,東京23区,,東京都大田区大森中二丁目14番13,京浜急行本線「大森町」駅より徒歩9分,JR京浜東北線「大森」駅よりバス11分「弁天神社」停留所より徒歩2分,,,通勤、通学、レジャー等幅広いニーズに対応するマルチアクセス\n商店街をはじめ、医療等日常に必要な生活施設が揃う周辺環境\n街並みに個性と存在感を主張して佇む１１階建てのフォルム,2920,3600,2920,3600,30.72㎡,46.47㎡,https://enq.nisshinfudosan.co.jp/form/fm/honsya/oomorimachi,Studio,1LDK,,,,,,,
2008/8/22,非表示,,日神デュオステージ三ツ沢公園,先着順受付中,http://www.duostage.com/mitsuzawakoen/,thumb/h20/mitsuzawakoen_icon.gif,神奈川,,神奈川県横浜市神奈川区三ツ沢西町7番40,横浜市営地下鉄3号線「三ツ沢上町」駅より徒歩5分,,,,最寄り駅より徒歩5分、「横浜」駅へ直通4分の快適な立地\n暮らしに便利な商業施設が充実した快適な住環境\n周囲の景観と調和するシンプルで落ち着きのある上品な外観,2390,3220,2390,3220,30.26㎡,45.13㎡,https://enq.nisshinfudosan.co.jp/form/fm/yokohama/mitsuzawakoen,1LDK,1LDK,,,,,,,
2008/8/8,非表示,,日神デュオステージ浅草,先着順受付中,http://www.duostage.com/asakusa/,thumb/h20/duoasakusa_icon.gif,東京23区,,東京都台東区西浅草二丁目12番1,つくばエクスプレス線「浅草」駅より徒歩3分,東京メトロ銀座線「田原町」駅より徒歩4分,,,浅草寺やかっぱ橋道具街などの名所が徒歩圏内\n６駅５路線利用可能で主要な都心エリアへ簡単にアクセス\n南向き住戸中心の明るいプラン設計で快適な暮らしが実現,2920,3540,2920,3540,30.21㎡,40.19㎡,https://enq.nisshinfudosan.co.jp/form/fm/honsya/asakusa,1DK,1LDK,,,,,,,
2008/8/8,非表示,,日神デュオステージ蔵前NEXT,先着順受付中,http://www.duostage.com/kuramae_next/,thumb/h20/kuramae_next_icon.gif,東京23区,,東京都台東区蔵前四丁目23番7,都営浅草線「蔵前」駅より徒歩4分,都営大江戸線「蔵前」駅より徒歩5分,,,4駅5路線利用可能。充実の都心ライフを叶えます\n歴史や文化を再発見できるロケーション\nスタイリッシュで気品溢れる全103邸。上質な生活を演出します,2830,3580,2830,3580,30.35㎡,40.98㎡,https://enq.nisshinfudosan.co.jp/form/fm/honsya/kuramae_next,1DK,1LDK,,,,,,,
2008/8/8,非表示,,日神デュオステージ練馬北町,先着順受付中,http://www.duostage.com/nerima_kitamachi/,thumb/h20/nerima_kita_icon.gif,東京23区,,東京都練馬区北町一丁目44番27,東武東上線「上板橋」駅より徒歩10分,東武東上線「東武練馬」駅より徒歩10分,,,東武東上線「上板橋」駅、「東武練馬」駅の２駅利用可能\n商店街や商業施設も充実しており毎日の暮らしに便利な住環境\n美しく機能的な設備仕様で、快適生活を満喫,2400,2580,2400,2580,30.32㎡,30.32㎡,https://enq.nisshinfudosan.co.jp/form/fm/honsya/nerima_kitamachi,1DK,1DK,,,,,,,
2008/8/8,非表示,,日神デュオステージ三ノ輪,先着順受付中,http://www.duostage.com/minowa/,thumb/h20/minowa_icon.gif,東京23区,,東京都台東区千束四丁目29番6,東京日比谷線「三ノ輪」駅より徒歩10分,つくばエクスプレス線「浅草」駅より徒歩11分,,,４駅３路線利用可能で都心へのアクセスが優れた立地\n住むほどに好きになる暮らしやすい街並み\n全９タイプ間取プラン。生活スタイルに合わせてお選びください,2470,2940,2470,2940,30.96㎡,40.97㎡,https://enq.nisshinfudosan.co.jp/form/fm/honsya/minowa,1DK,1LDK,,,,,,,
2008/7/31,非表示,,日神パレステージお花茶屋,棟内モデルルーム公開中,http://www.nisshinfudosan.co.jp/ohanajaya/,thumb/h20/ohanajaya_icon.gif,東京23区,,東京都葛飾区立石五丁目18番20,京成本線「お花茶屋」駅より徒歩8分,京成押上線「立石」駅より徒歩11分,,,２駅２路線利用可の好アクセス。都心までも楽に出られる立地\n全戸南向きの光の入る明るい住空間を提供\nウォークインクローゼットをはじめ、多くの収納スペースを確保,3560,3560,3560,3560,55.83㎡,55.83㎡,https://enq.nisshinfudosan.co.jp/form/fm/honsya/ohanajaya,2LDK,2LDK,,,,,,,
2008/7/25,非表示,,日神デュオステージ新御徒町,棟内モデルルーム公開中,http://www.duostage.com/shin-okachimachi/,thumb/h20/shinokachimachi_icon.gif,東京23区,,東京都台東区元浅草三丁目3番7,都営大江戸線、ＴＸ線「新御徒町」駅より徒歩5分,東京メトロ銀座線「稲荷町」駅より徒歩10分,,,徒歩圏に6駅7路線利用可能なマルチアクセス\n商店街や名所も徒歩圏の充実した周辺環境\n機能性と利便性に富んだ設備仕様。セキュリティも充実,2880,3620,2880,3620,30.30㎡,40.51㎡,https://enq.nisshinfudosan.co.jp/form/fm/honsya/shin-okachimachi,1DK,1LDK,,,,,,,
2008/7/10,非表示,,日神デュオステージ東向島,棟内モデルルーム公開中,http://www.duostage.com/higashimukojima/,thumb/h20/higashimukojima_icon.gif,東京23区,,東京都墨田区堤通一丁目14番6,東武伊勢崎線「東向島」駅より徒歩12分,東武伊勢崎線[曳舟」駅より徒歩13分,,,全24タイプの多彩なプランバリエーションをご用意しております\n大手町、日本橋、東京へも20分以内でアクセス可能\nお手入れしやすく安全なIHクッキングヒーターを設置,2940,3700,2940,3700,40.59㎡,57.01㎡,https://enq.nisshinfudosan.co.jp/form/fm/honsya/higashimukojima,1DK,2LDK,,,,,,,
2008/7/2,非表示,,日神パレステージ青梅住江町,棟内モデルルーム公開中,http://www.nisshinfudosan.co.jp/ome_sumiecho/,thumb/h20/ome_icon.gif,東京都下,,東京都青梅市住江町42番地の8,JR青梅線「青梅」駅より徒歩4分,,,,独立性を守り、広々とした配置で角住戸率68％を確保\n駅近でありながらも自然を感じられる恵まれた住環境\nほとんどが始発の「青梅」駅。通勤もラクラク,3080,3430,3080,3430,67.10㎡,67.52㎡,https://enq.nisshinfudosan.co.jp/form/fm/honsya/ome_sumiecyo,3LDK,3LDK,,,,,,,
2008/5/7,非表示,,日神デュオステージ大森西,先着順受付中,http://www.omori-color.jp/,thumb/h20/omorinishi_icon.gif,東京23区,,東京都大田区大森西一丁目10番10,京浜急行本線「平和島」駅より徒歩13分,JR京浜東北線「大森」駅より徒歩16分,,,最寄り駅から他線への連係がスムーズな好立地\n全24タイプのバリエーション豊富な間取りプランが魅力\n24時間セキュリティやオートロックシステムで安心都市生活,2490,3470,2490,3470,26.39㎡,43.20㎡,https://enq.nisshinfudosan.co.jp/form/fm/yokohama/omorinishi,Studio,1LDK,,,,,,,
2008/4/21,非表示,,日神パレステージ吹上,棟内モデルルーム公開中（予約制）,http://www.nisshinfudosan.co.jp/fukiage/,thumb/h20/fukiage_icon.gif,埼玉,,埼玉県鴻巣市吹上本町四丁目12番7,JR高崎線「吹上」駅より徒歩4分,,,,駅徒歩4分の好立地、生活施設も充実した恵まれた住環境\n明るい陽射しが注ぎ込む開放感ある全戸南向きプラン\n1５ｍを超えるロングアプローチを備え上質な佇まいを演出,2280,2760,2280,2760,76.14㎡,84.95㎡,https://enq.nisshinfudosan.co.jp/form/fm/oomiya/hukiage,3LDK,3LDK,,,,,,,
2008/2/27,非表示,,日神パレステージ鳩ヶ谷,マンションギャラリー公開中,http://sakurabato.com/,thumb/h20/hatogaya_icon.gif,埼玉,,埼玉県鳩ヶ谷市本町四丁目1番8号,埼玉高速鉄道線「鳩ヶ谷」駅より徒歩8分,,,,明るく開放感溢れる高台で爽やかな陽射しや桜が望める生活\n気品漂うヨーロピアンスタイルの優美な佇まい\n毎日の暮らしを豊かにする充実の収納スペースと設備・仕様,3110,4090,3110,4090,66.90㎡,80.35㎡,https://enq.nisshinfudosan.co.jp/form/fm/oomiya/hatogaya,1LDK+S+DEN,2LDK+S+DEN,,,,,,,
2007/12/10,非表示,,日神パレステージ河辺南,モデルルーム公開中,http://www.kabe-monogatari.com/,thumb/h19/kabe_icon.gif,東京都下,,東京都青梅市河辺町四丁目21番10,JR青梅線「河辺」駅より徒歩6分,,,,駅前の充実な施設と緑溢れる自然とが調和した豊かな住環境\n全21タイプの豊富なプランで多彩なライフスタイルが実現\nウォークインクローゼットをはじめとした豊富な収納を確保,3290,3780,3290,3780,72.80㎡,79.20㎡,https://enq.nisshinfudosan.co.jp/form/fm/honsya/kabeminami,2LDK+S+N,3LDK+S,,,,,,,
2007/11/30,非表示,,日神パレステージ船橋海神,棟内モデルルーム公開中,http://www.f-kaijin.com/,thumb/h19/funabashi-kaijin_icon.gif,千葉,,千葉県船橋市海神一丁目574番,JR総武線「船橋」駅より徒歩11分,東武野田線「船橋」駅より徒歩11分,,,明るく開放的な全住戸南東・南西向きの間取り\nシングルからファミリーまで様々な方に対応したルームプラン\n白と黒を基調としたモダンなつくりが高級感を演出,3340,3620,3340,3620,66.60㎡,69.48㎡,https://enq.nisshinfudosan.co.jp/form/fm/honsya/funabashi_kaijin,2LDK+S+DEN,3LDK+DEN,,,,,,,
2007/11/1,非表示,,日神デュオステージ大宮タウン,棟内モデルルーム公開中（予約制）,http://www.omiyatown.com/,thumb/h19/omiyatown_icon.gif,埼玉,,埼玉県さいたま市大宮区宮町五丁目136番1,JR京浜東北線・埼京線・宇都宮線・高崎線・湘南新宿ライン・川越線,「大宮」駅より徒歩10分,,,新幹線も含め14路線を自由自在に使いこなせる好立地\n駅周辺には大型商業施設が充実しワンランク上の住環境\n全戸南向きの明るい環境で機能性の高いルームプラン,2460,2740,2460,2740,40.05㎡,41.77㎡,https://enq.nisshinfudosan.co.jp/form/fm/oomiya/omiya_town,LDK+SR,1LDK,,,,,,,
2007/10/11,非表示,,日神パレステージ三山シャインプレイス,棟内モデルルーム公開中,http://www.iitokodori.jp/,thumb/h19/miyama_icon.gif,千葉,,千葉県船橋市三山八丁目30番12,JR総武線「津田沼」駅よりバス19分「三山車庫」停留所より徒歩3分,京成本線「京成大久保」駅より徒歩25分,,,快適生活に嬉しいミストサウナや床暖房を標準装備\n多彩なライフスタイルに合わせた全16タイプの間取りプラン\n便利なショッピング施設が揃った、暮らしやすい住環境,2488,2767,2488,2767,72.15㎡,84.20㎡,https://enq.nisshinfudosan.co.jp/form/fm/honsya/miyama_shineplace,3LDK,3LDK,,,,,,,
2007/11/1,非表示,,日神デュオステージ町田,棟内モデルルーム公開中(予約制）,http://www.duostage.com/bukken/02/0490/,thumb/h19/machida_icon.gif,東京都下,,東京都町田市金森1丁目373番1,JR横浜線「町田」駅より徒歩11分,小田急線「町田」駅より徒歩16分,,,小田急線とJR横浜線の2路線が利用可\n大型商業施設が充実した「町田」駅へ徒歩圏\nお部屋をお好みの空間に。カラーコーディネイトをご用意,2560,2590,2560,2590,35.19㎡,35.26㎡,https://enq.nisshinfudosan.co.jp/form/fm/yokohama/machida,2Ｋ,2Ｋ,,,,,,,
2007/10/9,非表示,,日神デュオステージ中野坂上NEXT,新宿マンションギャラリー公開中,http://www.duostage.com/bukken/01/0489/,thumb/h19/nakanosakaue_icon.gif,東京23区,,,東京メトロ丸ノ内線「中野坂上」駅より徒歩3分,都営地下鉄大江戸線「中野坂上」駅より徒歩3分 「東中野」駅より徒歩12分,,,,,,,,,,,1DK,1DK,,,,,,,
2007/9/27,非表示,,日神デュオステージ船橋,現地内覧会開催中（予約制）,http://www.duostage.com/bukken/04/0488/,thumb/h19/funabashi_icon.gif,千葉,,千葉県船橋市宮本一丁目1933番1,JR総武線「船橋」駅より徒歩10分,東武野田線「船橋」駅より徒歩10分,,,最寄りの「船橋」駅は、あらゆる大型商業施設が充実\nビジネスにもレジャーにも便利な快適アクセスが可能\nキッチンには安全・安心なIHクッキングヒーターを設置,2730,3010,2730,3010,40.04㎡,40.04㎡,https://enq.nisshinfudosan.co.jp/form/fm/honsya/funabashi,1LDK,1LDK,,,,,,,
2007/8/9,非表示,,日神デュオステージ横須賀中央,モデルルーム公開中,http://www.duostage.com/bukken/02/0487/,thumb/h19/yokosukachuo_icon.gif,神奈川,,神奈川県横須賀市小川町2番6,京浜急行本線「横須賀中央」駅より徒歩9分,,,,文化施設とショッピング施設が融合した豊かな生活環境\n横須賀の街並みに調和したシックで洗練された外観\nより上質な暮らしを創る機能的な設備・仕様を標準装備,2310,2660,2310,2660,34.02㎡,39.61㎡,https://enq.nisshinfudosan.co.jp/form/fm/yokohama/yokosuka_chuo,1DK,1LDK,,,,,,,
2007/7/5,非表示,,日神デュオステージ蒔田,横浜マンションギャラリー公開中（予約制）,http://www.statuslife.jp/,thumb/h19/maita_icon.gif,神奈川,,,横浜市営地下鉄線「蒔田」駅より徒歩6分　「吉野町」駅より徒歩7分,,,,,,,,,,,,1DK,1DK,,,,,,,
2007/7/3,非表示,,日神パレステージ籠原,棟内モデルルーム公開中(予約制),http://www.nisshinfudosan.co.jp/kagohara/,thumb/h19/kagohara_icon.gif,埼玉,,埼玉県熊谷市新堀1145番地1,JR高崎線「籠原」駅より徒歩14分,,,,地球にも家族にも優しいオール電化採用で安心と快適な生活\n全戸東南向きで、緑と光の街に佇む明るい邸宅\n敷地内駐車場100%で、家族のライフスタイルが充実,1920,3260,1920,3260,75.94㎡,91.85㎡,https://enq.nisshinfudosan.co.jp/form/fm/oomiya/kagohara,3LDK,4LDK,,,,,,,
2007/6/14,非表示,,日神デュオステージ大森町,新宿マンションギャラリー公開中,http://www.duostage.com/bukken/01/0484/,thumb/h19/omori-machi_icon.gif,東京23区,,,京浜急行本線「大森町」駅より徒歩9分,京浜急行本線「梅屋敷」駅より徒歩9分,,,,,,,,,,,Studio,1LDK,,,,,,,
2007/6/11,非表示,,日神デュオステージ池上,新宿マンションギャラリー公開中,http://www.ikegami-style.com/,thumb/h19/ikegami_icon.gif,東京23区,,東京都大田区池上1丁目25番13,東急池上線「池上」駅より徒歩10分,都営浅草線「西馬込」駅より徒歩19分,,,商店街や池上本門寺など賑わいと温もりが調和した住環境\n落ち着いた趣ある街並みに調和しながらも品格ある佇まい\nセキュリティ充実で都市生活も安心・快適,2970,3110,2970,3110,30.19㎡,30.35㎡,https://enq.nisshinfudosan.co.jp/form/fm/honsya/ikegami,1DK,1DK,,,,,,,
2007/2/28,非表示,,日神パレステージ東久留米WEST,棟内モデルルーム公開中(予約制),http://www.kurume-kirameku.com/,thumb/h19/kurumewest_icon.gif,東京都下,,東京都東久留米市下里五丁目659番1,西武池袋線「東久留米」駅よりバス12分「西団地入口」停留所より徒歩3分,西武新宿線「花小金井」駅よりバス15分「西団地入口」停留所より徒歩3分,,,住戸の88%が南西・南東向きで光と風が家族を優しく包み込む\n全住戸分駐車場完備で、ご家族のライフスタイルが充実\n万一の大震災からご家族や財産を守る「耐震等級2」,3510,4160,3510,4160,65.10㎡,76.04㎡,https://enq.nisshinfudosan.co.jp/form/fm/honsya/higashikurume_west,3LDK,3LDK,,,,,,,
2007/7/5,非表示,,日神デュオステージ亀戸,先着順受付中,http://www.duostage.com/bukken/04/0483/,thumb/h19/kameido_icon.gif,東京23区,,,JR総武線「亀戸」駅より徒歩6分,東武亀戸線「亀戸」駅より徒歩6分,,,,,,,,,,,1DK,1DK,,,,,,,
2007/2/5,非表示,,日神パレステージ武蔵砂川,棟内モデルルーム公開中(予約制),http://www.musasuna.com/,thumb/h19/musashisunagawa_icon.gif,東京都下,,東京都立川市一番町四丁目30番1他,西武拝島線「武蔵砂川」駅より徒歩10分,,,,大型ショッピング施設が徒歩圏に揃い明るく充実した住環境\n学校・病院と同じ「耐震等級２」の確かな品質と信頼性\nエントランスと駐車場を分ける事により安全面を考慮,3000,3430,3000,3430,68.26㎡,73.26㎡,https://enq.nisshinfudosan.co.jp/form/fm/honsya/musashisunagawa,3LDK,3LDK+DEN,,,,,,,
2007/5/25,非表示,,日神デュオステージ大泉学園,先着順受付中,http://www.duostage.com/bukken/03/0481/,thumb/h19/oizumigakuen_icon.gif,東京23区,,,西武池袋線「大泉学園」駅より徒歩10分,,,,,,,,,,,,1DK,1DK,,,,,,,
2007/5/22,非表示,,日神デュオステージ関内大通り公園,横浜マンションギャラリー公開中（予約制）,http://www.duostage.com/bukken/02/0480/,thumb/h19/kannaiod_icon.gif,神奈川,,,JR根岸線「関内」駅より徒歩7分,横浜市営地下鉄線「伊勢佐木長者町」駅より徒歩1分,,,,,,,,,,,1DK,1LDK,,,,,,,
2006/12/11,非表示,,日神パレステージ三ツ池公園,棟内見学会開催中,http://www.nisshinfudosan.co.jp/mitsuikekoen/,thumb/h19/mitsuikekoen_icon.gif,神奈川,,,京浜東北線「鶴見」駅よりバス11分 バス停「末吉小学校前」徒歩4分,,,,,,,,,,,,2LDK+S,4LDK,,,,,,,
2007/3/19,非表示,,日神デュオステージ大宮浅間町,先着順受付中,http://www.duo-smilelife.com/,thumb/h19/omiya_sengencho_icon.gif,埼玉,,,JR京浜東北線・埼京線・宇都宮線・高崎線・湘南新宿ライン・川越線「大宮」駅より徒歩12分,JR京浜東北線・宇都宮線・高崎線「さいたま新都心」駅より徒歩13分,,,,,,,,,,,1DK,1LDK,,,,,,,
